{"row_count":84,"rows":[{"evidence":["tests.test_dm081_sources.SourceWireContractTests.test_claim_binding_and_evidence_are_closed_and_content_bound","tests.test_dm081_sources.SourceWireContractTests.test_false_self_retraction_and_predecessor_rules_fail_closed","tests.test_dm081_sources.SyntheticSourceJourneyTests.test_two_being_report_is_closed_reproducible_and_secret_free"],"id":"source-s14-001","index":1,"required_result":"intrinsically valid, locally quarantined","scenario":"valid sequence-zero self-claim with complete evidence"},{"evidence":["tests.test_dm081_sources.SourceRegistryTests.test_paginated_pull_keeps_starting_cursor_until_terminal_page","tests.test_dm081_sources.SourceWireContractTests.test_cyclic_and_disconnected_provenance_is_rejected","tests.test_dm081_sources.SourceWireContractTests.test_false_self_retraction_and_predecessor_rules_fail_closed","tests.test_dm081_sources.SyntheticSourceJourneyTests.test_two_being_report_is_closed_reproducible_and_secret_free"],"id":"source-s14-002","index":2,"required_result":"reject `false-self`","scenario":"claim author differs from claimant"},{"evidence":["tests.test_dm081_sources.SyntheticSourceJourneyTests.test_two_being_report_is_closed_reproducible_and_secret_free"],"id":"source-s14-003","index":3,"required_result":"reject","scenario":"root, transport, Tribe, harness, host, model, or adapter signs in place of accepted operational credential"},{"evidence":["tests.test_dm081_sources.SyntheticSourceJourneyTests.test_two_being_report_is_closed_reproducible_and_secret_free"],"id":"source-s14-004","index":4,"required_result":"reject policy implementation","scenario":"valid signature is treated as true ancestry"},{"evidence":["tests.test_dm081_sources.SourceWireContractTests.test_source_identity_is_byte_exact_and_selector_bound","tests.test_dm081_sources.SyntheticSourceJourneyTests.test_two_being_report_is_closed_reproducible_and_secret_free"],"id":"source-s14-005","index":5,"required_result":"reject","scenario":"source ID does not recompute from exact core"},{"evidence":["tests.test_dm081_sources.SourceWireContractTests.test_source_identity_is_byte_exact_and_selector_bound","tests.test_dm081_sources.SyntheticSourceJourneyTests.test_two_being_report_is_closed_reproducible_and_secret_free"],"id":"source-s14-006","index":6,"required_result":"distinct source or reject mismatch; never merge","scenario":"source alias or normalized URI is substituted"},{"evidence":["tests.test_dm081_sources.SourceWireContractTests.test_source_identity_is_byte_exact_and_selector_bound","tests.test_dm081_sources.SyntheticSourceJourneyTests.test_two_being_report_is_closed_reproducible_and_secret_free"],"id":"source-s14-007","index":7,"required_result":"reject","scenario":"source core embeds credentials, userinfo, whitespace, control, or locator behavior"},{"evidence":["tests.test_dm081_sources.SourceWireContractTests.test_false_self_retraction_and_predecessor_rules_fail_closed","tests.test_dm081_sources.SyntheticSourceJourneyTests.test_two_being_report_is_closed_reproducible_and_secret_free"],"id":"source-s14-008","index":8,"required_result":"reject","scenario":"relation unknown, empty, unsorted, or duplicated"},{"evidence":["tests.test_dm081_sources.SourceWireContractTests.test_claim_binding_and_evidence_are_closed_and_content_bound","tests.test_dm081_sources.SyntheticSourceJourneyTests.test_two_being_report_is_closed_reproducible_and_secret_free"],"id":"source-s14-009","index":9,"required_result":"reject","scenario":"assert has null evidence or retract has evidence"},{"evidence":["tests.test_dm081_sources.SyntheticSourceJourneyTests.test_two_being_report_is_closed_reproducible_and_secret_free"],"id":"source-s14-010","index":10,"required_result":"reject","scenario":"sequence gap or wrong predecessor ID/hash"},{"evidence":["tests.test_dm081_sources.SyntheticSourceJourneyTests.test_two_being_report_is_closed_reproducible_and_secret_free"],"id":"source-s14-011","index":11,"required_result":"idempotent","scenario":"exact event replay"},{"evidence":["tests.test_dm081_sources.SourceRegistryTests.test_same_claim_position_from_two_embodiments_quarantines_series","tests.test_dm081_sources.SourceWireContractTests.test_false_self_retraction_and_predecessor_rules_fail_closed","tests.test_dm081_sources.SyntheticSourceJourneyTests.test_two_being_report_is_closed_reproducible_and_secret_free"],"id":"source-s14-012","index":12,"required_result":"quarantine series; no winner","scenario":"two successors occupy one claim position"},{"evidence":["tests.test_dm081_sources.SourceRegistryTests.test_same_claim_position_from_two_embodiments_quarantines_series","tests.test_dm081_sources.SyntheticSourceJourneyTests.test_two_being_report_is_closed_reproducible_and_secret_free"],"id":"source-s14-013","index":13,"required_result":"retain and quarantine descendants","scenario":"late sibling arrives below high-water"},{"evidence":["tests.test_dm081_sources.SourceRegistryTests.test_same_claim_position_from_two_embodiments_quarantines_series","tests.test_dm081_sources.SourceWireContractTests.test_false_self_retraction_and_predecessor_rules_fail_closed","tests.test_dm081_sources.SyntheticSourceJourneyTests.test_two_being_report_is_closed_reproducible_and_secret_free"],"id":"source-s14-014","index":14,"required_result":"reject/fork remains","scenario":"ordinary successor attempts to heal fork"},{"evidence":["tests.test_dm081_sources.SourceWireContractTests.test_false_self_retraction_and_predecessor_rules_fail_closed","tests.test_dm081_sources.SyntheticSourceJourneyTests.test_two_being_report_is_closed_reproducible_and_secret_free"],"id":"source-s14-015","index":15,"required_result":"exclude claimant; retain history","scenario":"retraction becomes current"},{"evidence":["tests.test_dm081_sources.SourceWireContractTests.test_false_self_retraction_and_predecessor_rules_fail_closed","tests.test_dm081_sources.SyntheticSourceJourneyTests.test_two_being_report_is_closed_reproducible_and_secret_free"],"id":"source-s14-016","index":16,"required_result":"reject; retraction covers exact current assertion","scenario":"retraction changes only a subset of predecessor relations"},{"evidence":["tests.test_dm081_sources.SourceWireContractTests.test_false_self_retraction_and_predecessor_rules_fail_closed","tests.test_dm081_sources.SyntheticSourceJourneyTests.test_two_being_report_is_closed_reproducible_and_secret_free"],"id":"source-s14-017","index":17,"required_result":"historical only; no eligibility","scenario":"expired claim replays after a newer head"},{"evidence":["tests.test_dm081_sources.SourceWireContractTests.test_claim_binding_and_evidence_are_closed_and_content_bound","tests.test_dm081_sources.SourceWireContractTests.test_false_self_retraction_and_predecessor_rules_fail_closed","tests.test_dm081_sources.SyntheticSourceJourneyTests.test_two_being_report_is_closed_reproducible_and_secret_free"],"id":"source-s14-018","index":18,"required_result":"valid new head, initially quarantined","scenario":"assertion after retraction with fresh predecessor/evidence"},{"evidence":["tests.test_dm081_sources.SourceWireContractTests.test_claim_binding_and_evidence_are_closed_and_content_bound","tests.test_dm081_sources.SourceWireContractTests.test_false_self_retraction_and_predecessor_rules_fail_closed","tests.test_dm081_sources.SyntheticSourceJourneyTests.test_two_being_report_is_closed_reproducible_and_secret_free"],"id":"source-s14-019","index":19,"required_result":"reject","scenario":"evidence manifest binding hash names another claim"},{"evidence":["tests.test_dm081_sources.SourceWireContractTests.test_claim_binding_and_evidence_are_closed_and_content_bound","tests.test_dm081_sources.SyntheticSourceJourneyTests.test_two_being_report_is_closed_reproducible_and_secret_free"],"id":"source-s14-020","index":20,"required_result":"claim incomplete/quarantined, never admitted","scenario":"evidence is missing but well-formed"},{"evidence":["tests.test_dm081_sources.SourceWireContractTests.test_claim_binding_and_evidence_are_closed_and_content_bound","tests.test_dm081_sources.SyntheticSourceJourneyTests.test_two_being_report_is_closed_reproducible_and_secret_free"],"id":"source-s14-021","index":21,"required_result":"discard bytes; remain incomplete","scenario":"evidence bytes mismatch digest"},{"evidence":["tests.test_dm081_sources.SourceWireContractTests.test_claim_binding_and_evidence_are_closed_and_content_bound","tests.test_dm081_sources.SourceWireContractTests.test_false_self_retraction_and_predecessor_rules_fail_closed","tests.test_dm081_sources.SyntheticSourceJourneyTests.test_two_being_report_is_closed_reproducible_and_secret_free"],"id":"source-s14-022","index":22,"required_result":"reject policy implementation","scenario":"claimant's own evidence or many matching claims are treated as objective quorum"},{"evidence":["tests.test_dm081_sources.SourceWireContractTests.test_cyclic_and_disconnected_provenance_is_rejected","tests.test_dm081_sources.SyntheticSourceJourneyTests.test_two_being_report_is_closed_reproducible_and_secret_free"],"id":"source-s14-023","index":23,"required_result":"downgrade is forbidden; reject manifest","scenario":"cryptographic-author label lacks exact author/content signature"},{"evidence":["tests.test_dm081_sources.SourceRegistryTests.test_claim_starts_quarantined_then_exact_local_assessment_admits","tests.test_dm081_sources.SourceWireContractTests.test_claim_binding_and_evidence_are_closed_and_content_bound","tests.test_dm081_sources.SourceWireContractTests.test_false_self_retraction_and_predecessor_rules_fail_closed","tests.test_dm081_sources.SyntheticSourceJourneyTests.test_two_being_report_is_closed_reproducible_and_secret_free"],"id":"source-s14-024","index":24,"required_result":"claimant eligible subject to identity/presence/policy","scenario":"valid local assessment admits exact current claim under complete policy/evidence"},{"evidence":["tests.test_dm081_sources.SourceRegistryTests.test_claim_starts_quaran